token;sentimento
Câmara aprova MP que concede reajuste salarial a servidores federais;-1
Banco Central comunica vazamento de dados de 238 chaves Pix;-1
Câmara aprova texto-base do novo arcabouço fiscal, mas deixa de fora mudança defendida pelo governo;1
Appy defende gestão centralizada e compartilhada de conselho federativo na tributária;0
Decisão de Moraes permitiu continuidade dos estudos para construção da Ferrogrão, diz ministro;1
Governo decide retirar tributação de “offshores” de MP e enviar PL sobre o assunto taxação de fundos exclusivos também será encaminhada;-1
Ministro defende que serviços de turismo tenham alíquota diferenciada na reforma tributária;0
Custo de financiamento da dívida já se reduziu com avanço da tributária, diz Ceron;1
Lira confirma compromisso da Câmara em repor despesas condicionadas na LDO de 24;1
EDP Brasil (ENBR3): CVM aprova registro em categoria ‘B’ e ação da companhia deixa de ser negociada na B3;-1
Ficou sabendo? Impactos do apagão no varejo transparência de dados da China;0
E mais: Meta lança versão web do Threads.;1
123Milhas não oferece ‘risco sistêmico’ e governo agirá, diz ministro;1
Investigação conjunta sobre o caso entre as pastas do Turismo e da Justiça não tem prazo para ser concluída.;-1
O bilionário vietnamita que fez fortuna com SPAC e quer ultrapassar Elon Musk;0
Ações de sua montadora VinFast subiram 255% na semana passada, superando gigantes como GM e Mercedes.;1
Lula prioriza cúpula do Brics sob risco de atrasar arcabouço fiscal;-1
Presidente está em Johanesburgo acompanhado de Haddad para defender o grupo do ‘Sul Global’.;0
Howdy.com compra brasileira GeekHunter, dos gêmeos Tomás e Celso Ferrari;0
Plataforma de recrutamento em tecnologia será subsidiária da empresa americana de gerenciamento de talentos.;0
Fiagro da Kinea tem maior crescimento patrimonial em 12 meses;1
Levantamento do Clube FII destaca que entre os cinco Fiagros com maior crescimento no valor patrimonial, o Kinea Crédito Agro (KNCA11) lidera nos últimos 12 meses encerrados em julho.;1
Batalha contra inflação no Brasil não está ganha, diz Campos Neto;-1
Segundo o presidente do Banco Central, a autoridade monetária precisa persistir com uma postura restritiva.;-1
Ação do Banco do Brasil: desconto em bolsa é exagerado, diz Guide entenda;-1
Avaliação acontece após análises dos resultados do segundo trimestre dos quatro principais bancos listados na bolsa brasileira.;0
Banco do Nordeste vai pagar R$ 218,9 milhões em juros sobre capital próprio;0
Montante corresponde ao valor de R$ 2,53 por ação.;0
Ibovespa fecha em alta, puxado por Vale e expectativa sobre arcabouço fiscal;1
Já o dólar encerrou em queda sobre o real, pressionado pelo cenário internacional mais favorável a ativos de risco.;1
Greenvolt assina três contratos de fornecimento de energia nos EUA a 20 anos;1
A empresa liderada por João Manso Neto assegura o fornecimento de energia gerada em três parques solares à Dominion Energy.;1
Receita do imposto do selo já ronda os dois mil milhões;0
Compra de imóveis voltou a dar no ano passado o maior contributo para a subida na arrecadação e garantiu 367 milhões de euros sobre os valores pagos em escrituras. Serviços financeiros, como a contratação de crédito, são ainda a maior fatia e deram 696 milhões.;0
Autarquias captam 303 milhões das receitas do IUC;0
O reforço para as finanças locais ocorreu depois de o valor arrecadado com o IUC ter alcançado os 772,6 milhões de euros, num crescimento de 3,9%, apenas ligeiramente inferior aos 4% de subida registados no ano anterior.;1
A cola que une o inconciliável;1
O bloco que junta Brasil, Rússia, China e África do Sul tem como aglutinador o facto de funcionar como uma plataforma conjunta de críticas ao Ocidente e às suas organizações, nomeadamente ao Banco Mundial, FMI e ONU, numa lógica de contraponto ao G7. Contudo, tirando esse fator, pouco ou quase nada tem unido estes países.;-1
SVB obrigado a ajustar bónus de gestores;0
Atualmente em insolvência, o grupo SVB tem em curso um plano de pagamento de bónus de 12,5 milhões de dólares para manter os gestores do braço de capital, SVB Capital, e o conseguir vender. Teve, contudo, de fazer ajustamentos.;-1
Reformismo vs reversionismo;0
O veto do PR ao pacote Mais Habitação suscita várias questões. Uma delas é tentar perceber porque Costa insiste em ter contra si todo o espetro partidário: ninguém apoia a nova lei, nem sequer o PCP e o Bloco.;-1
Vermelho domina em Wall Street. Só Nasdaq escapa;-1
Depois de um rally nas tecnológicas na segunda-feira, os índices norte-americanas fecharam maioritariamente com perdas, com o setor da banca a ser o que mais caiu no S&ampP 500.;-1
Rei de Espanha propõe investidura de Feijóo;0
Depois de ouvir os partidos, a Casa Real comunicou à presidência do Congresso que Feijóo é o nome escolhido para a investidura.;0
Goldman Sachs junta-se a consórcio para compra da Subway;0
A TDR Capital e a Sycamore Partners aliaram-se à gestora de ativos do Goldman Sachs e a um fundo soberano na tentativa de o consórcio ser o comprador escolhido pela cadeia de sanduíches.;0
Valor da isenção temporária de IMI subiu 63% em 2022;1
Em causa está a isenção de IMI que é atribuída pelo prazo máximo de três anos a casas destinadas a habitação própria e permanente de valor patrimonial tributário (VTP) até 125 mil euros de famílias cujo rendimento bruto anual não exceda os 153.300 euros.;0
BdP alerta para entidades sem autorização na atividade de ativos virtuais;-1
A instituição liderada por Mário Centeno lançou um alerta sobre as entidades BTC Evex 360, BTC ifex 360 e Bitcoin 360 ai.;-1
Decisão nas mãos do Rei: depois de Sánchez, Feijóo também pede investidura;0
Alberto Nuñez Feijóo considera que tem argumentos para ser investido por Filipe VI, apesar de ainda precisar de quatros deputados para reunir a necessária maioria absoluta.;0
Petrobras vê potencial para produzir petróleo por mais três ou quatro décadas;1
A Petrobras tem reservas provadas de 10,5 mil milhões de barris de petróleo equivalente e uma produção diária de cerca de 2,6 milhões de barris.;1
Putin insta Banco Central da Rússia a conter instabilidade financeira;1
Vladimir Putin garantiu ainda estar a acompanhar de perto a subida dos riscos inflacionistas, vincando que o principal objetivo é agora conter a subida dos preços.;1
SIFIDE representou um terço da despesa fiscal em IRC em 2022;0
De acordo com o relatório da despesa fiscal de 2022, as deduções à coleta atribuídas por via do SIFIDE resultaram numa despesa fiscal em sede de IRC de 444,6 milhões de euros.;0
Mudança na cúpula da Comissão Europeia: Sefcovic substitui Timmermans na pasta do clima;0
O vice-presidente do executivo comunitário resignou esta terça-feira para se candidatar a primeiro-ministro dos Países Baixos. Ursula von der Leyen entregou a pasta do clima ao vice-presidente Maros Sefcovic, com a responsabilidade do Pacto Ecológico Europeu.;0
Lula nega que BRICS sirvam de contraponto ao G20 ou EUA;1
O Presidente do Brasil lembrou que BRICS representam nova forma de organização do sul global e não um contraponto do G7, G20 ou Estados Unidos. Sugeriu também a criação de uma nova moeda de comércio exterior.;0
Tecnológicas impulsionam bolsas europeias com maior subida num mês;1
Acompanhe aqui, minuto a minuto, o desempenho dos mercados durante esta terça-feira.;0
Norte-americano Millennium reforça aposta contra ações da Galp;-1
A petrolífera viu o norte-americano Millennium Management Global Investment duplicar a sua aposta na queda das ações da Galp.;-1
Exclusivo: “Custos para voar no Brasil são os mais caros do mundo”, diz CEO da Azul;-1
Durante a programação da BM&C News, o CEO da Azul (AZUL4), John Rodgerson, deu sua opinião sobre o programa Voa Brasil;0
Ibovespa fecha em alta pela segunda vez no mês de agosto;1
As atenções de investidores do Ibovespa também se voltaram para a votação do arcabouço e falas de Campos Neto, presidente do Banco Central;0
Receita Federal arrecada R$ 201,8 bilhões em julho;0
Pelo segundo mês seguido, a arrecadação total das Receitas Federais apresentou queda, atingindo, em julho, um total de R$ 201,83 bilhões. Considerando a inflação do período, o decréscimo real ficou em 4,2% na comparação com julho de 2022, quando foram arrecadados R$ 202,59 bilhões. Queda de arrecadação também no acumulado do ano. De acordo com ;-1
Copel inaugura temporada de privatizações de empresas estaduais;1
Perspectivas de redução de custos e ganhos de eficiência embasam projeções de ganho com ações após venda do controle estatal A privatização da Copel (Companhia Paranaense de Energia), finalizada no começo desta semana, abriu a temporada de venda do controle de estatais prometida por governadores eleitos ou reeleitos no ano passado. Nesse pacote, as privatizações ;1
CVM incentiva clubes de futebol a captar recursos no mercado de capitais;1
Em entrevista exclusiva, João Pedro Nascimento comenta o Parecer de Orientação 41 e o que falta para as SAFs acessarem a poupança popular Criadas em 2021 pela Lei 14.193, as Sociedades Anônimas do Futebol (SAFs) trouxeram para o mundo do futebol as práticas de gestão empresariais. Desde então, times como Botafogo, Cruzeiro, Vasco, Bahia e, ;1
JP Morgan compra 4,90% do capital social da Zamp (ZAMP3) ações disparam;1
No início do pregão desta terça-feira (22), os papéis da Zamp (ZAMP3), ex-Burger King, chegaram a subir mais de 18%;1
Voto de minerva sobre juros foi na reunião em junho, diz Campos Neto;0
O presidente do Banco Central, Roberto Campos Neto, afirmou nesta terça-feira (22) que o voto de minerva ocorreu, na verdade, na reunião do Comitê de Política Monetária (Copom) de junho, não em agosto. A autoridade monetária enfatizou que o último encontro apenas elevou a intensidade da flexibilização. Campos Neto disse que foi o voto de ;0
Você colocaria seu filho na escola de Elon Musk?;0
Quando pensamos em Elon Musk, imediatamente imaginamos foguetes, carros elétricos e,é claro, seus singulares tweets. No entanto, o bilionário tem uma carta na manga menosdiscutida: uma escola. Não, não é uma escola para formar pequenos Elon Musks (bom,talvez um pouco), mas é definitivamente uma visão do futuro da educação. Por que uma escola, Elon? Como;0
Ibovespa opera em alta com mercado monitorando o exterior;1
Investidores do Ibovespa estão de olho nos 'tresuries' nos EUA e os estímulos fracos da economia chinesa que mexe com as commodities;0
Votação do novo arcabouço fiscal, arrecadação federal e o que move o mercado hoje;0
Os índices futuros dos Estados Unidos operam em alta nesta terça-feira (22), em dia de bom humor no mercado global após diversas perdas nas semanas anteriores. A agenda conta com dados de vendas de moradias usadas, com o consenso do mercado apontando para 4,15 milhões. Outro destaque foi do S&P Global, que fez um movimento ;1
Ibovespa fecha em queda pressionado pelo exterior;-1
No cenário doméstico a pauta econômica também ficou no radar dos investidores do Ibovespa, às vésperas de votação do arcabouço;0
Pronome Neutro é proibido em escolas de BH;-1
Na última sexta-feira, 18, foi publicada no Diário Oficial do Município de Belo Horizonte uma lei que proíbe estudantes e professores de usarem pronomes neutros e linguagem não binária nas escolas públicas e privadas da capital de Minas Gerais. A autoria do projeto é atribuída ao deputado Nikolas Ferreira (PL), e a nova regra já ;-1
Ruqi Mobility pede listagem em Hong Kong e planeja investir no desenvolvimento de condução autônoma;1
A Ruqi Travel é uma empresa de serviços e tecnologia de viagens dedicada a criar um sistema de soluções de tecnologia de viagens tridimensional e completo;1
Nvidia: o teste de fogo da empresa que mais se valorizou no ano e entrou para o clube do trilhão;1
Fabricante de chips para inteligência artificial terá o desafio de entregar o crescimento expressivo prometido para o balanço do segundo trimestre resultado será apresentado na noite de quarta-feira;1
Restituição do Imposto de Renda: saiba qual é a correção aplicada no 4º lote;0
A correção atual é maior do que a aplicada no terceiro lote o pagamento será realizado no dia 31 de agosto;1
7 dicas de como vender mais para aumentar o seu negócio;0
Diversificar os métodos de pagamento e criar anúncios criativos e atrativos para as redes sociais são estratégias altamente recomendadas;1
Ibovespa tem maior alta do mês de agosto em dia de recuperação;1
Rendimento do título de 10 anos do Tesouro americano volta a subir mas não freia efeito-rebote das bolsas globais;-1
Dólar hoje 22/08: fecha em queda com cenário otimista no mercado internacional;1
Moeda americana fecha em queda com bom humor do mercado;-1
‘Eu não torço para a bolsa subir’, diz gestor – entenda o motivo;0
Para Raphael Maia, da Organon, bolsa barata está abrindo uma oportunidade de compra única;1
Títulos dos EUA esfriam após máxima em 16 anos, arcabouço em Brasília e o que mais move o mercado;0
Índices de Wall Street dão continuidade aos ganhos da véspera, após três semanas de queda;1
Mega-Sena passa a ter três sorteios por semana veja como vai funcionar;0
Nesta terça-feira, 22, será sorteado um prêmio de R$ 3 milhões;0
Por que todas as atenções do mercado estão nas montanhas frias de Jackson Hole;0
Incerteza e rali dos treasuries antecedem discurso do presidente do Fed no fim desta semana bolsas desabaram após Jerome Powell evocar Volcker em simpósio do ano passado;-1
Senacon e Procon notificam 123 Milhas por suspensão de pacotes veja quais são os seus direitos;-1
A modalidade de venda de passagens por meio de transferência de milhas precisa atender a previsão do Código de Defesa do Consumidor;0
Morgan Stanley vê piora de confiança no S&P, Goldman discorda;0
Dois dos principais estrategistas de renda variável de Wall Street estão em lados opostos da discussão sobre a capacidade de os EUA evitar uma recessão;0
Receita libera consulta ao 4º lote de restituição do IR na quinta-feira veja quem recebe;0
O crédito bancário para 6.118.310 contribuintes será realizado no final do mês no valor total de RS 7,5 bilhões;1
Ibovespa volta a cair com EUA, China e negociação por arcabouço no radar;-1
Índice registra sua 14ª queda dos últimos 15 pregões rendimento das treasuries avança;-1
Como começar a empreender: guia completo para iniciantes;0
Neste guia, oferecemos um sólido embasamento para aqueles que desejam ingressar nessa fascinante trajetória;0
Dólar Hoje 21/08: fechou em alta em dia de agenda econômica mais fraca;-1
Moeda americana fechou em alta com agenda econômica fraca e reunião do Brics em vista;-1
Decisão do BC da China, Focus, Kapitalo compra 3R, Singapura vende Raízen e o que move o mercado;0
Bolsas sobem no Ocidente, após quedas da semana passada queda de juros mais branda do Banco Popular da China decepciona investidores locais;-1
Caixa paga novo Bolsa Família a beneficiários com NIS de final 2;0
Desde março, o Bolsa Família paga outro adicional, de R$ 150 a famílias com crianças de até 6 anos;0
Dividendos e JCP do BB (BBAS3): último dia para investir e receber dividendos do 2º tri;0
Estatal vai pagar R$ 2,27 bilhões em proventos referentes ao último balanço;0
Uma aposta ganha prêmio de mais de R$ 4 milhões da Mega-Sena;0
quina teve 34 apostas vencedoras cada acertador vai receber R$ 74.175,48;0
Lucro menor e alta na bolsa? Entenda porque S&P 500 sobe mesmo com resultados mais fracos no 2º tri;-1
Levantamento da Economatica mostrou desaceleração nos números apresentados no segundo trimestre;-1
Plano de saúde não pode considerar sintomas como doença preexistente;0
Ao contratar um plano de saúde, a declaração de saúde é um documento de preenchimento obrigatório que visa esclarecer se a pessoa tem conhecimento de que possui doenças ou lesões preexistentes;0
Mega-Sena: veja o resultado do concurso 2.622 prêmio é de R$ 4,6 milhões;0
Prêmio para a aposta que acertar as seis dezenas é de R$ 4,6 milhões;0
Renegociou dívidas com o Desenrola? Próximo passo é planejamento, apontam especialistas;0
Débitos abaixo de R$ 100 não foram perdoados e devem ser quitados;1
123 Milhas: comprou passagem Promo e não sabe se conseguirá voar? Veja perguntas e respostas;0
Quem já teve passagem emitida não terá a viagem cancelada, mas clientes que ainda não receberam seus localizadores não irão viajar;-1
Texto segue para análise do Senado FederaThe postCâmara aprova MP que concede reajuste salarial a servidores federai appeared first onInfoMone;-1
Dados cadastrais de clientes da Phi Pagamentos, que não afetaram a movimentação de dinheiro, foram expostoThe postBanco Central comunica vazamento de dados de 238 chaves Pi appeared first onInfoMone;-1
Texto segue para sanção do presidente Luiz Inácio Lula da Silva. Aprovação marca o fim do teto de gastos, que vigorou por seis anoThe postCâmara aprova texto-base do novo arcabouço fiscal, mas deixa de fora mudança defendida pelo govern appeared first onInfoMone;1
Criação do colegiado tem provocado divergências no modelo de governança e temores de superpoderes para definição de políticas tributáriaThe postAppy defende gestão centralizada e compartilhada de conselho federativo na tributári appeared first onInfoMone;-1
Ministro também mencionou outras obras do setor ferroviário, como a Ferrovia de Integração Oeste-Leste (Fiol) e a TransnordestinThe postDecisão de Moraes permitiu continuidade dos estudos para construção da Ferrogrão, diz ministr appeared first onInfoMone;1
Movimento ocorre em meio a resistências da Câmara dos Deputados em aceitar manobra para votar mudança de carona em outra medida provisóriThe postGoverno decide retirar tributação de offshores de MP e enviar PL sobre o assunto taxação de fundos exclusivos também será encaminhad appeared first onInfoMone;-1
Estudo do Ministério da Fazenda apontou que a alíquota-padrão dos impostos que serão criados com a proposta de reforma tributária pode chegar a 27The postMinistro defende que serviços de turismo tenham alíquota diferenciada na reforma tributári appeared first onInfoMone;-1
Secretário do Tesouro diz que economia com o fechamento significativo da curva de juros é de centenas de bilhões de reaiThe postCusto de financiamento da dívida já se reduziu com avanço da tributária, diz Cero appeared first onInfoMone;1
Emenda foi apresentada no Senado pelo líder do governo no Congresso, senador Randolfe Rodrigues, com apoio da ministra do Planejamento, Simone TebeThe postLira confirma compromisso da Câmara em repor despesas condicionadas na LDO de 2 appeared first onInfoMone;1
Há assembleia marcada para 30 de agosto na qual será definida a proposta de resgate compulsório das 22,8 milhões de ações ainda em circulaçãThe postEDP Brasil (ENBR3): CVM aprova registro em categoria B& e ação da companhia deixa de ser negociada na B appeared first onInfoMone;1